{
  "constitution_version": "0.1",
  "sources": [
    {
      "id": "source:alpha",
      "epistemic_role": "SOURCE",
      "source_type": "repository_file",
      "repository": "example/research",
      "locator": {
        "path": "results/alpha.json",
        "commit": "0123456789abcdef0123456789abcdef01234567"
      },
      "source_role": "experiment_record"
    }
  ],
  "claims": [
    {
      "id": "claim:normalized:v1",
      "epistemic_role": "NORMALIZED",
      "proposition": "The source records metric alpha as 3.",
      "scope": "The cited source field only.",
      "ceiling": "A transcription claim; no scientific interpretation.",
      "source_ids": ["source:alpha"],
      "status_id": "status:normalized:v1"
    },
    {
      "id": "claim:derived:v1",
      "epistemic_role": "DERIVED",
      "proposition": "The normalized metric is nonzero.",
      "scope": "A deterministic arithmetic observation over claim:normalized:v1.",
      "ceiling": "A derived arithmetic statement; no scientific interpretation.",
      "source_ids": ["source:alpha"],
      "status_id": "status:derived:v1"
    }
  ],
  "relations": [],
  "statuses": [
    {
      "id": "status:normalized:v1",
      "epistemic_role": "NORMALIZED",
      "subject_id": "claim:normalized:v1",
      "value": "EARNED",
      "scope": "Recorded transcription status only.",
      "effective_commit": "0123456789abcdef0123456789abcdef01234567",
      "source_ids": ["source:alpha"]
    },
    {
      "id": "status:derived:v1",
      "epistemic_role": "NORMALIZED",
      "subject_id": "claim:derived:v1",
      "value": "OPEN",
      "scope": "Derived record remains open to revision.",
      "effective_commit": "0123456789abcdef0123456789abcdef01234567",
      "source_ids": ["source:alpha"]
    }
  ],
  "experiments": [],
  "artifacts": [],
  "provenance": [
    {
      "id": "provenance:claim:normalized:v1",
      "subject_id": "claim:normalized:v1",
      "subject_role": "NORMALIZED",
      "source_refs": [
        {
          "source_id": "source:alpha",
          "source_locator": "$.metrics.alpha",
          "subject_field": "proposition"
        }
      ],
      "parent_normalized_ids": []
    },
    {
      "id": "provenance:claim:derived:v1",
      "subject_id": "claim:derived:v1",
      "subject_role": "DERIVED",
      "source_refs": [],
      "parent_normalized_ids": ["claim:normalized:v1"],
      "derivation": "Compare the normalized numeric value with zero."
    },
    {
      "id": "provenance:status:normalized:v1",
      "subject_id": "status:normalized:v1",
      "subject_role": "NORMALIZED",
      "source_refs": [
        {
          "source_id": "source:alpha",
          "source_locator": "$.recorded_status",
          "subject_field": "value"
        }
      ],
      "parent_normalized_ids": []
    },
    {
      "id": "provenance:status:derived:v1",
      "subject_id": "status:derived:v1",
      "subject_role": "NORMALIZED",
      "source_refs": [
        {
          "source_id": "source:alpha",
          "source_locator": "$.recorded_status",
          "subject_field": "value"
        }
      ],
      "parent_normalized_ids": []
    }
  ]
}
