{
  "constitution_version": "0.1",
  "sources": [
    {
      "id": "source:history",
      "epistemic_role": "SOURCE",
      "source_type": "repository_file",
      "repository": "example/research",
      "locator": {
        "path": "history/revision.json",
        "commit": "abcdef0123456789abcdef0123456789abcdef01"
      },
      "source_role": "revision_record"
    }
  ],
  "claims": [
    {
      "id": "claim:history:v1",
      "epistemic_role": "NORMALIZED",
      "proposition": "Version one records alpha as 2.",
      "scope": "Version one source field.",
      "ceiling": "Transcription only.",
      "source_ids": ["source:history"],
      "status_id": "status:history:v1"
    },
    {
      "id": "claim:history:v2",
      "epistemic_role": "NORMALIZED",
      "proposition": "Version two records alpha as 3.",
      "scope": "Version two source field.",
      "ceiling": "Transcription only.",
      "source_ids": ["source:history"],
      "status_id": "status:history:v2"
    }
  ],
  "relations": [
    {
      "id": "relation:history:v1-to-v2",
      "epistemic_role": "DERIVED",
      "relation_type": "SUPERSEDES",
      "source_object_id": "claim:history:v1",
      "target_object_id": "claim:history:v2",
      "scope": "The explicitly recorded alpha-field revision.",
      "provenance_id": "provenance:relation:history:v1-to-v2"
    }
  ],
  "statuses": [
    {
      "id": "status:history:v1",
      "epistemic_role": "NORMALIZED",
      "subject_id": "claim:history:v1",
      "value": "TERMINAL",
      "scope": "Superseded transcription record.",
      "effective_commit": "abcdef0123456789abcdef0123456789abcdef01",
      "source_ids": ["source:history"]
    },
    {
      "id": "status:history:v2",
      "epistemic_role": "NORMALIZED",
      "subject_id": "claim:history:v2",
      "value": "EARNED",
      "scope": "Current transcription record within this fixture.",
      "effective_commit": "abcdef0123456789abcdef0123456789abcdef01",
      "source_ids": ["source:history"]
    }
  ],
  "experiments": [],
  "artifacts": [],
  "provenance": [
    {
      "id": "provenance:claim:history:v1",
      "subject_id": "claim:history:v1",
      "subject_role": "NORMALIZED",
      "source_refs": [{"source_id": "source:history", "source_locator": "$.versions[0].alpha", "subject_field": "proposition"}],
      "parent_normalized_ids": []
    },
    {
      "id": "provenance:claim:history:v2",
      "subject_id": "claim:history:v2",
      "subject_role": "NORMALIZED",
      "source_refs": [{"source_id": "source:history", "source_locator": "$.versions[1].alpha", "subject_field": "proposition"}],
      "parent_normalized_ids": []
    },
    {
      "id": "provenance:relation:history:v1-to-v2",
      "subject_id": "relation:history:v1-to-v2",
      "subject_role": "DERIVED",
      "source_refs": [],
      "parent_normalized_ids": ["claim:history:v1", "claim:history:v2"],
      "derivation": "Record the explicit supersession declared by the revision artifact."
    },
    {
      "id": "provenance:status:history:v1",
      "subject_id": "status:history:v1",
      "subject_role": "NORMALIZED",
      "source_refs": [{"source_id": "source:history", "source_locator": "$.versions[0].status", "subject_field": "value"}],
      "parent_normalized_ids": []
    },
    {
      "id": "provenance:status:history:v2",
      "subject_id": "status:history:v2",
      "subject_role": "NORMALIZED",
      "source_refs": [{"source_id": "source:history", "source_locator": "$.versions[1].status", "subject_field": "value"}],
      "parent_normalized_ids": []
    }
  ]
}
